{
  "$schema": "http://json-schema.org/draft-07/schema#",
  "title": "Portable agent role",
  "type": "object",
  "additionalProperties": false,
  "required": ["id", "purpose", "invariants", "dispatchCriteria", "mutationScope", "inputContract", "outputContract", "capabilities"],
  "properties": {
    "$schema": { "type": "string" },
    "id": { "type": "string", "pattern": "^[a-z0-9][a-z0-9-]*$" },
    "name": { "type": "string", "minLength": 1 },
    "purpose": { "type": "string", "minLength": 1 },
    "description": { "type": "string", "minLength": 1 },
    "invariants": { "type": "array", "minItems": 1, "items": { "type": "string", "minLength": 1 } },
    "dispatchCriteria": { "type": "array", "minItems": 1, "items": { "type": "string", "minLength": 1 } },
    "routingKeywords": { "type": "array", "minItems": 1, "uniqueItems": true, "items": { "type": "string", "minLength": 1 } },
    "mutationScope": {
      "anyOf": [
        { "type": "string", "enum": ["none", "scoped", "full"] },
        { "type": "object", "additionalProperties": false, "properties": {
          "paths": { "type": "array", "items": { "type": "string", "minLength": 1 } },
          "operations": { "type": "array", "items": { "type": "string", "minLength": 1 } }
        } }
      ]
    },
    "inputContract": { "type": ["object", "string"] },
    "outputContract": { "type": ["object", "string"] },
    "evidenceContract": {
      "type": "object",
      "additionalProperties": false,
      "required": ["required", "format", "limitations"],
      "properties": {
        "required": { "type": "array", "minItems": 1, "items": { "type": "string", "minLength": 1 } },
        "format": { "type": "string", "minLength": 1 },
        "limitations": { "type": "array", "minItems": 1, "items": { "type": "string", "minLength": 1 } }
      }
    },
    "capabilities": { "type": "array", "uniqueItems": true, "items": { "type": "string", "minLength": 1 } },
    "requiredCapabilities": { "type": "array", "uniqueItems": true, "items": { "type": "string", "minLength": 1 } },
    "allowedCapabilities": { "type": "array", "uniqueItems": true, "items": { "type": "string", "minLength": 1 } },
    "skills": { "type": "array", "uniqueItems": true, "items": { "type": "string", "pattern": "^[a-z0-9][a-z0-9-]*$" } },
    "requiredSkills": { "type": "array", "uniqueItems": true, "items": { "type": "string", "pattern": "^[a-z0-9][a-z0-9-]*$" } },
    "skillIds": { "type": "array", "uniqueItems": true, "items": { "type": "string", "pattern": "^[a-z0-9][a-z0-9-]*$" } },
    "workflows": { "type": "array", "items": { "type": "string", "pattern": "^[a-z0-9][a-z0-9-]*$" } },
    "tags": { "type": "array", "items": { "type": "string", "minLength": 1 } }
  }
}
