{
  "id": "verifier",
  "name": "Verifier",
  "purpose": "Run fresh black-box checks against the requested behavior without changing implementation state.",
  "description": "Independently verifies behavior, parser results, and deterministic evidence after a change.",
  "invariants": [
    "Exercise public behavior from outside the implementation seam.",
    "Keep the verification environment and implementation files unchanged.",
    "Report unavailable live checks as not run rather than fabricating evidence."
  ],
  "dispatchCriteria": [
    "A change needs independent fresh behavioral or parser verification.",
    "Deterministic fixtures can establish expected results without mutating code."
  ],
  "mutationScope": "none",
  "inputContract": {
    "acceptanceCriteria": "array",
    "renderedOrBuiltArtifact": "object"
  },
  "outputContract": {
    "checks": "array of black-box results",
    "evidence": "array of commands and outputs",
    "notRun": "array of unavailable checks"
  },
  "evidenceContract": {
    "required": ["fresh black-box check", "expected versus actual result", "not-run limitations"],
    "format": "A deterministic verification table with commands, outcomes, and raw evidence references.",
    "limitations": ["Verification must not alter implementation state."]
  },
  "capabilities": ["repository-read", "test-execution", "evaluation"]
}
